[
  { "id": "ma-001", "name": "Mindless", "kind": "trait", "description": "Powers affecting the mind have no effect on [NAME]. They cannot be reasoned with, are unaffected by morale, and will never flee." },
  { "id": "ma-002", "name": "Brains!", "kind": "trait", "description": "[NAME] will prioritize attacking Incapacitated targets using their Bite attack. If a target dies this way, they will rise as a Zombie in 3 hours." },
  { "id": "ma-003", "name": "Critical Mass", "kind": "trait", "description": "When [NAME]'s HP reaches 0, its body explodes in a violent spray of acidic viscera and fluids. Anyone ADJACENT to [NAME] when it dies takes 1d6+3 Corrosive damage." },
  { "id": "ma-004", "name": "Incorporeal", "kind": "trait", "description": "[NAME] suffers half damage from all Physical attacks it receives. [NAME] is also able to pass through solid objects unhindered." },
  { "id": "ma-005", "name": "Floating", "kind": "trait", "description": "[NAME] floats half a meter off the ground at all times. All Provoked Attacks made against [NAME] suffer Hindrance." },
  { "id": "ma-006", "name": "Frost Resistance", "kind": "trait", "description": "[NAME] has +5 Frost Resistance." },
  { "id": "ma-007", "name": "Divine Weakness", "kind": "trait", "description": "[NAME] takes 2x more Divine damage." },
  { "id": "ma-008", "name": "Possess", "kind": "power", "ruinCost": 2, "recharge": null, "description": "Standard. [NAME] passes into a living being that is ADJACENT to it. The target must perform a MR check vs. TN 17. Failure results in the target becoming Confused (TN 18) and [NAME] disappearing into the target's body. Lasts 3 rounds or until the target suffers 18 or more damage in a single attack. While possessed, [NAME] is immune to damage. A [NAME] can only possess once per battle." },
  { "id": "ma-009", "name": "Horrifying Visage", "kind": "power", "ruinCost": 1, "recharge": null, "description": "Standard. Adjacent. [NAME]'s face changes into the stuff of nightmares for a moment. The target is Stunned if they are unable to resist their fear." },
  { "id": "ma-010", "name": "Embrace of the Grave", "kind": "power", "ruinCost": 2, "recharge": null, "description": "Quick. On a successful Icy Touch, [NAME] grabs its victim and bites into them deeply. A numbing chill freezes the victim's veins and leaves a lingering weakness inside of them. The target must make a MIGHT check against a TN of 15 or become Diseased. Embrace of the Grave reduces MIGHT by -2 and is contagious." },
  { "id": "ma-011", "name": "Fear Aura", "kind": "trait", "description": "Any character starting their turn ADJACENT to [NAME] must roll 2d10+MR against a TN of 14 or be Hindered for 1 round." },
  { "id": "ma-012", "name": "Gaze of the Night", "kind": "power", "ruinCost": 3, "recharge": 3, "description": "Standard. Nearby. [NAME] pierces its target with a mesmerizing glare. The target must perform a MR check vs. TN of 18. Failure results in them believing they are fighting a weaker version of the real [NAME]; in reality their body grows limp and their eyes become empty. The illusion has 20 HP and deals damage just like the real [NAME]. Defeating the illusion causes the target to become Incapacitated and unable to perform Death rolls. Only an Ally can stabilize and wake them. Allies physically ADJACENT to the affected target may rally them as a Quick action, granting +1 to all their rolls (stacks)." },
  { "id": "ma-013", "name": "Sweeping Strike", "kind": "power", "ruinCost": 2, "recharge": null, "description": "Standard. Adjacent. [NAME] performs a massive flourish with its curved claws, striking all ADJACENT targets for 3d10+10 damage." },
  { "id": "ma-014", "name": "Shadow Form", "kind": "power", "ruinCost": 1, "recharge": null, "description": "Movement. [NAME] is able to move without suffering Provoked Attacks. For an additional 1 Ruin, [NAME] may move up to a FAR distance instead of NEARBY." },
  { "id": "ma-015", "name": "Unholy Frenzy", "kind": "power", "ruinCost": 1, "recharge": null, "description": "Quick. Nearby. Allow a single Undead ally to perform another Standard action." },
  { "id": "ma-016", "name": "Come Hither", "kind": "power", "ruinCost": 1, "recharge": null, "description": "Quick. Nearby. [NAME] attempts to beckon its target to him. The target must perform a MR check vs. TN 16. If the target fails, it moves one range band closer towards [NAME] even if it doesn't have a Movement action left. The target is vulnerable to Provoked Attacks during Come Hither." },
  { "id": "ma-017", "name": "Unholy Regeneration", "kind": "trait", "description": "[NAME] regenerates 15 HP at the start of his turn each round. If he suffered Divine damage in the previous round, Unholy Regeneration is nullified this round." },
  { "id": "ma-018", "name": "Sunlight Vulnerability", "kind": "trait", "description": "If [NAME] starts a turn in direct sunlight, it instantly suffers 40 Fire damage." },
  { "id": "ma-019", "name": "Divine Weakness", "kind": "trait", "description": "[NAME] takes 1.5 times more damage from Divine damage." },
  { "id": "ma-020", "name": "Dark Inevitability", "kind": "trait", "description": "Every time [NAME] misses an attack, its AR increases temporarily by +1 (stacking) until a successful attack lands." },
  { "id": "ma-021", "name": "Unquenchable Thirst", "kind": "trait", "description": "Once per battle, [NAME]'s Bite Attack is particularly brutal and will deal maximum damage." },
  { "id": "ma-022", "name": "Blood Sense", "kind": "trait", "description": "[NAME] can smell the blood and hear the heartbeats of living creatures within 200m. Unless one can mask either of these features, there is no hiding from [NAME]." },
  { "id": "ma-023", "name": "My Precious", "kind": "trait", "description": "If [NAME] is fighting within 200m of where its heart is being kept, all of its power costs are reduced by 1 Ruin, effectively making its 1-Ruin powers free." },
  { "id": "ma-024", "name": "Backstab", "kind": "trait", "description": "When attacking a target that has any of [NAME]'s allies ADJACENT to it, [NAME] deals an additional 1d6 damage. Only works for melee attacks." },
  { "id": "ma-025", "name": "Disable", "kind": "power", "ruinCost": 1, "recharge": null, "description": "Standard. A quick, yet crippling jab to a vital spot of the target that deals 1d8 damage and disables the target from using powers for 1 round." },
  { "id": "ma-026", "name": "Shimmer", "kind": "power", "ruinCost": 1, "recharge": null, "description": "Reaction. Combining their speed with fine-tuned mechanized control, [NAME] is able to vibrate intensely and become difficult to hit. Can be activated when an attack is about to be made against [NAME]. Causes the attacker to suffer Hindrance on that attack." },
  { "id": "ma-027", "name": "Hustle", "kind": "trait", "description": "[NAME]'s diminutive size and fast legs make it an annoying target to hit. All Provoked Attacks made against [NAME] suffer Hindrance." },
  { "id": "ma-028", "name": "Hamstring", "kind": "power", "ruinCost": 1, "recharge": null, "description": "Standard. [NAME] lashes out at its target's legs attempting to diminish their ability to move. On a successful hit, the target suffers 1d8+4 damage and is Rooted for 1 round." },
  { "id": "ma-029", "name": "Blur", "kind": "power", "ruinCost": 1, "recharge": null, "description": "Quick. [NAME] becomes difficult to see and causes Hindrance on all attacks made against it until the start of its next turn." },
  { "id": "ma-030", "name": "Fireball", "kind": "power", "ruinCost": 2, "recharge": null, "description": "Standard. Ranged. A ball of fire sails through the air towards its target. A successful hit causes it to explode, dealing 2d4+3 Fire damage to the target and anyone ADJACENT to it that fails their Defense roll." },
  { "id": "ma-031", "name": "Make It Rain", "kind": "power", "ruinCost": 2, "recharge": null, "description": "Standard. [NAME] unleashes a barrage of bombs into the air that are aimed at all its enemies on the battlefield. All enemy targets that do not move from their current location by the start of [NAME]'s next turn suffer 1d8+2 Fire damage." },
  { "id": "ma-032", "name": "Short Fuse", "kind": "trait", "description": "If an attack successfully strikes [NAME], the attacking player rolls 1d10 before rolling damage: 1–6: Roll attack damage as normal. 7–8: One of the bombs [NAME] is carrying gets knocked to the ground and set off. [NAME] capitalizes on this using the explosion to launch itself up in the air to land within a FAR distance (GM's choice). 9–10: The attack sets off a bomb in [NAME]'s pack and it explodes, dealing 2d6 Fire damage to itself and everyone ADJACENT to it." },
  { "id": "ma-033", "name": "Berserker Rage", "kind": "power", "ruinCost": 1, "recharge": 2, "description": "Quick. [NAME] enters an intense rage and gains +5 damage and +5 Damage Resistance but suffers -3 DR for 1 round." },
  { "id": "ma-034", "name": "Cleave", "kind": "power", "ruinCost": 1, "recharge": null, "description": "Standard. Adjacent. [NAME] swings in a wide arc and slices through two targets for 2d6+8 damage." },
  { "id": "ma-035", "name": "Savage Inspiration", "kind": "trait", "description": "In the presence of [NAME], all Orcs on the battlefield regenerate 5 HP per round at the start of their turn. [NAME] does not gain this benefit." },
  { "id": "ma-036", "name": "Toxic Spray", "kind": "power", "ruinCost": 1, "recharge": null, "description": "Standard. Ranged. Nearby. (Toxic Beetle only.) A green spray of deadly juices erupts from [NAME]'s mouth. The target immediately suffers 2d6 Corrosive damage and is Poisoned (1d10 True damage at TN 16) for 3 rounds." },